{
  "schema": "hpi/wire/handoff-bundle/v2",
  "handoff_id": "HO-TS001-001",
  "task_ref": {
    "id": "TS001-IMPL",
    "revision": "beedcb19fa802a5ebf5230b762ee3a32b734424e4e7ebebf22eb1d2529385b28",
    "sha256": "beedcb19fa802a5ebf5230b762ee3a32b734424e4e7ebebf22eb1d2529385b28",
    "pointer": "tests/fixtures/ts001/task-slices/ts001-impl.v2.json"
  },
  "sender": {
    "agent_id": "agent-coordinator",
    "role": "COORDINATOR",
    "harness_revision": "harness/pilot-v1"
  },
  "receiver": {
    "agent_id": "agent-impl",
    "role": "IMPLEMENTATION",
    "harness_revision": "harness/pilot-v1"
  },
  "input_revisions": [
    {
      "id": "DOC-HPI-PRD",
      "revision": "1",
      "sha256": "b9cdff8541bc7809aad32025e3c530a48b9e774c70a0af3e6437310cfe4a6c26",
      "pointer": "human-project-interaction-skills-prd.md"
    },
    {
      "id": "DOC-HPI-TECH-DESIGN",
      "revision": "1",
      "sha256": "4a1e5c8720bce7cd5615f6e6de95854a7dcdddefb91915b6dd18f6667c1bfcf8",
      "pointer": "human-project-interaction-skills-technical-design.md"
    },
    {
      "id": "TS001-IMPL",
      "revision": "beedcb19fa802a5ebf5230b762ee3a32b734424e4e7ebebf22eb1d2529385b28",
      "sha256": "beedcb19fa802a5ebf5230b762ee3a32b734424e4e7ebebf22eb1d2529385b28",
      "pointer": "tests/fixtures/ts001/task-slices/ts001-impl.v2.json"
    },
    {
      "id": "TS1-TEST-001",
      "revision": "1",
      "sha256": "e0aeffc678717ba7416b5ff775683ec00919ecc9bdf6054327f6020dedfb9804",
      "pointer": "09_TS001_测试与回滚验收.md"
    }
  ],
  "objective": "在 runtime 实现前先固定 Schema、权限/引用、幂等与回滚合同及测试基线。",
  "non_goals": [
    "不写 project canonical 状态。",
    "不实现科学算法。"
  ],
  "permission_scope": {
    "allowed_paths": [
      "09_TS001_测试与回滚验收.md",
      "schemas/**",
      "src/**",
      "tests/**"
    ],
    "forbidden_paths": [
      "canonical/**"
    ],
    "data_classes": [
      "INTERNAL"
    ],
    "network": {
      "mode": "DENY",
      "allowed_hosts": []
    }
  },
  "expected_output": "Schema、权限/引用、幂等与回滚测试用例及凭证。",
  "acceptance_ref": {
    "id": "TS1-TEST-001",
    "revision": "1",
    "sha256": "e0aeffc678717ba7416b5ff775683ec00919ecc9bdf6054327f6020dedfb9804",
    "pointer": "09_TS001_测试与回滚验收.md"
  },
  "failure_semantics": "测试失败保持 INCOMPLETE；不伪造 PASS。",
  "context_summary": {
    "text": "执行 TS-001 实现任务切片，结构化字段优先。",
    "authoritative": false,
    "purpose": "ORIENTATION_ONLY"
  },
  "safe_default": "NO_STATE_CHANGE",
  "idempotency_key": "1b87750de13e2e5817aa1f2e8ae1e5fcdde09fb964ed158448cf556026453e67",
  "changed_fields": [],
  "provenance_refs": [
    {
      "id": "TS1-TEST-001",
      "revision": "1",
      "sha256": "e0aeffc678717ba7416b5ff775683ec00919ecc9bdf6054327f6020dedfb9804",
      "pointer": "09_TS001_测试与回滚验收.md"
    }
  ],
  "created_at": "2026-08-29T10:05:00.000Z",
  "handoff_revision": "d9c4fd46062ed147db96e51739f96636ff80cdb823206df4d48327f37e15e328"
}
